mid,sid,node_i,node_j,utterance,uid
0883,0883_002,0883_003,0883_018,"bruised and torn, as Westley crawls slowly toward her.Can you move at all?(weakly stretching out an arm toward him)I told you, ""I would always come for you."" Why didn't you wait for me?Well ... you were dead.Death cannot stop true love. All it can do is delay it for a while.I will never doubt again.WESTLEY Ha. Your pig fiance is too late. A few more steps and we'll be safe in the Fire Swamp.and Westley has tried to say it with Chevalier-like nonchalance, but she ain't buying. We'll never survive.Nonsense -- you're only saying that because no one ever has. It's not that bad. I'm not saying I'd like to build a summer home here, but the trees are actually quite lovely. instantly forcing Buttercup to sit, gathering her flaming hem in his hands, doing his best to suffocate the fire. This isn't all that easy and it causes him a bit of grief, but he does his best to sound as jaunty as before. Well now, that was an adventure. Singed a bit, were you?(She wasn't and she shakes her head ""no"")Well, one thing I will say. The Fire Swamp certainly does keep you on your toes. (happily) This will all soon be but a happy memory because Roberts' ship ""Revenge"" is anchored at the far end. And I, as you know, am Roberts.But how is that possible, since he's been marauding twenty years and you only left me five years ago?I myself am often surprised at life's little quirks. You see, what I told you before about saying ""please"" was true. It intrigued Roberts, as did my descriptions of your beauty. Finally, Roberts decided something. He said, ""All right, Westley, I've never had a valet. You can try it for tonight. I'll most likely kill you in the morning."" Three years he said that. ""Good night, Westley. Good work. Sleep well. I'll most likely kill you in the morning."" It was a fine time for me. I was learning to fence, to fight, anything anyone would teach me. And Roberts and I eventually became friends. And then it happened.What? -- go on --Well, Roberts had grown so rich, he wanted to retire. So he took me to his cabin and told me his secret. ""I am not the Dread Pirate Roberts,"" he said. ""My name is Ryan. I inherited this ship from the previous Dread Pirate Roberts, just as you will inherit it from me. The man I inherited it from was not the real Dread Pirate Roberts, either. His name was Cummerbund. The real Roberts has been retired fifteen years and living like a king in Patagonia."" Then he explained the name was the important thing for inspiring the necessary fear. You see, no one would surrender to the Dread Pirate Westley. So we sailed ashore, took on an entirely new crew and he stayed aboard for awhile as first mate, all the time calling me Roberts. Once the crew believed, he left the ship and I have been Roberts ever since. Except, now that we're together, I shall retire and hand the name over to someone else. Is everything clear to you?placed against a tree. Westley is cleaning the lightning sand from her face. He hesitates, glances around and CUT TO: We'll never succeed -- we may as well die here.No. No. We have already succeeded. I mean, what are the three terrors of the Fire Swamp? One, the flame spurts. No problem. There's a popping sound preceding each, we can avoid that. Two, the Lightning Sand. But you were clever enough to discover what that looks like, so in the future we can avoid that too.Westley, what about the R.O.U.S.'s?Rodents of Unusual Size? I don't think they exist...screaming and -- Westley!jumping onto its back, and the R.0.U.S. is all over him now, sinking needle teeth into Westley's shoulder. with death close at hand, as a popping sound starts. He tries one desperate move, rolls into the sound -- with the R.0.U.S. pinned under him, and as the beast bursts into flame, it lets go and Westley rolls safely free, grabs his sword and exhaustedly stabs the R.0.U.S., which is trying to put itself out.relieved. (almost in disbelief) We did it.It will not happen!(roaring right back, bigger) DEATH FIRST!!whirling to face her. What was that?I thought you were dead once, and it almost destroyed me. I could not bear it if you died again, not when I could save you.","0883_0260,0883_0261,0883_0262,0883_0263,0883_0264,0883_0265,0883_0266,0883_0274,0883_0275,0883_0276,0883_0277,0883_0278,0883_0279,0883_0280,0883_0281,0883_0282,0883_0283,0883_0284,0883_0285,0883_0286,0883_0287,0883_0288,0883_0289,0883_0296,0883_0299,0883_0302,0883_0308"
0883,0883_002,0883_003,0883_016,"(roaring with laughter) You only think I guessed wrong -- watching him. You fell victim to one of the classic blunders. The most famous is ""Never get involved in a land war in Asia."" But only slightly less well known is this: ""Never go in against a Sicilian when death is on the line.""",0883_0222
0883,0883_002,0883_003,0883_014,(almost a smile) I swear it will be done.,0883_0307
0883,0883_002,0883_003,0883_006,"Iocane. I'd bet my life on it.Oh, my sweet Westley; what have I done?Disappeared. He must have seen us closing in, which might account for his panicking in error. Unless I'm wrong, and I am never wrong, they are headed dead into the fire swamp.looking from one to the other; then something else catches her eye and we -- looking the other way --frantically staring around, and now CUT TO: Will you promise not to hurt him?talking to them both. If we surrender, and I return with you, will you promise not to hurt this man?May I live a thousand years and never hunt again.(looks at Westley) He is a sailor on the pirate ship ""Revenge."" Promise to return him to his ship.and her face is sad. Pallid, perhaps ill. She wanders down a corridor in Florin Castle. As she moves unseeing past an intersecting corridor: CUT TO:","0883_0239,0883_0258,0883_0259,0883_0297,0883_0300,0883_0303,0883_0304,0883_0305,0883_0321"
0883,0883_002,0883_000,0883_018,"You have six fingers on your right hand -- someone was looking for you -- Where am I?(he only whispers) The Pit of Despair. (garbled) Don't even think -- (A hack, sputter, cough - now his voice seems normal again)Then I'm here till I die?(working away) Till they kill you. Yeah.Then why bother curing me?The Prince and the Count always insist on everyone being healthy before they're broken.So it's to be torture. I can cope with torture. You don't believe me?","0883_0313,0883_0314,0883_0315,0883_0316,0883_0317,0883_0318,0883_0319"
0883,0883_002,0883_000,0883_003,You survived the Fire Swamp. You must be very brave...,0883_0320
0883,0883_002,0883_005,0883_014,(unbelieving) Of course.,0883_0323
0883,0883_003,0883_014,0883_018,"Get some rest -- if you haven't got your health, you haven't got anything. Beautiful, isn't it? It took me half a lifetime to invent it. I'm sure you've discovered my deep and abiding interest in pain. At present I'm writing the definitive work on the subject. So I want you to be totally honest with me on how The Machine makes you feel. This being our first try, I'll use the lowest setting.He has suction cups on his head now, on his temple, on his heart, his hands and feet. He says nothing, keeps control of himself CUT TO: and he's lying on the table, and he's only flesh and the chains are metal and thick, but such is his desperation it almost seems he might break them. A terrible sound comes from his throat, an incessant gasping. It keeps on coming as we finally CUT TO:As you know, the concept of the suction pump is centuries old. Well, really, that's all this is. Except that instead of sucking water, I'm sucking life. I've just sucked one year of your life away. I might one day go as high as five, but I really don't know what that would do to you. So, let's just start with what we have. What did this do to you? Tell me. And remember, this is for posterity, so be honest -- how do you feel?in anguish so deep it is dizzying. Helpless, he cries.","0883_0351,0883_0352,0883_0353,0883_0354"
0883,0883_003,0883_006,0883_020,My father's final words were...,0883_0325
0883,0883_003,0883_006,0883_019,"in his quarters, swamped. Piles of papers are strewn all over. Now YELLIN, a pale, shifty, quick-eyed man appears in the doorway. Yellin.(bows, then kneels) Sire.As Chief Enforcer of all Florin, I trust you with this secret: killers from Guilder are infiltrating the Thieves' Forest and plan to murder my bride on our wedding night.Of course. She will not be murdered. On the day of the wedding, I want the Thieves' Forest emptied and every inhabitant arrested.Many of the thieves will resist. My regular enforcers will be inadequate.Form a Brute Squad then. I want the Thieves' Forest emptied before I wed.It won't be easy, Sire.","0883_0356,0883_0357,0883_0358,0883_0363,0883_0364,0883_0365,0883_0366"
0883,0883_003,0883_005,0883_020,"(off-screen) -- hold it. Hold it, Grandpa. You read that wrong. She doesn't marry Humperdinck, she marries Westley. I'm just sure of it. After all that Westley did for her, if she does not marry him, it wouldn't be fair.Well, who says life is fair? Where is that written? Life isn't always fair.I'm telling you you're messing up the story, now get it right!Do you want me to go on with this?Yes.(off-screen, still reading) It was ten days till the wedding. The King still lived, but Buttercup's nightmares were growing steadily worse.(off-screen) See? Didn't I tell you she'd never marry that rotten Humperdinck?","0883_0326,0883_0327,0883_0328,0883_0329,0883_0330,0883_0338,0883_0339"
0883,0883_003,0883_006,0883_014,"I could never cause you grief; consider our wedding off.Yes.I suggest a deal. You write four copies of a letter. I'll send my four fastest ships. One in each direction. The Dread Pirate Roberts is always close to Florin this time of year. We'll run up the white flag and deliver your message. If Westley wants you, bless you both. If not ... please consider me as an alternative to suicide. Are we agreed?Your Princess is really a winning creature. A trifle simple, perhaps, but her appeal is undeniable.Oh, I know. The people are quite taken with her. It's odd, but when I hired Vizzini to have her murdered on our engagement day, I thought that was clever. But it's going to be so much more moving when I strangle her on our wedding night. Once Guilder is blamed, the nation will be truly outraged. They'll demand we go to war.Now, where is that secret knot? It's impossible to find. (Finding the knot on the tree he hits it, and it opens, revealing a staircase leading underground.)Tyrone, you know how much I love watching you work. But, I've got my country's five hundredth anniversary to plan, my wedding to arrange, My wife to murder, and Guilder to frame for it. I'm swamped.Interesting.","0883_0342,0883_0343,0883_0346,0883_0347,0883_0348,0883_0349,0883_0350,0883_0355"
0883,0883_003,0883_003,0883_019,My spy network has heard no such news.,0883_0359
0883,0883_003,0883_003,0883_006,"My father's final words were ""love her as I loved her, and there will be joy."" I present to you your Queen. Queen Buttercup.bursting into the Prince's chambers. Count Rugen stands nearby. It comes to this: I love Westley. I always have. I know now I always will. If you tell me I must marry you in ten days, please believe I will be dead by morning.Then we will simply alert him.My Westley will always come for me.entering. Any word from Westley?Too soon, my angel. Patience.He will come for me.","0883_0332,0883_0341,0883_0344,0883_0345,0883_0360,0883_0361,0883_0362"
0883,0883_003,0883_003,0883_005,"coming out of her nightmare, alone in her castle bedroom. As she frantically grabs a robe and starts to run.(off-screen) -- yes, you're very smart. Shut-Up.","0883_0337,0883_0340"
0883,0883_003,0883_001,0883_003,"touched as before, but then she seems stunned as we CUT TO: Why do you do this?Because you had love in your hands, and you gave it up.(distraught) But they would have killed Westley if I hadn't done it.Your true love lives and you marry another --","0883_0333,0883_0334,0883_0335,0883_0336"
0883,0883_003,0883_005,0883_006,"(off-screen) The King died that very night, and before the following dawn, Buttercup and Humperdinck were married. (off-screen) And at noon, she met her subjects again. This time as their Queen.All right, then. No more interruptions.(alone, exhausted) Try ruling the world sometime.","0883_0324,0883_0331,0883_0367"
0883,0883_004,0883_006,0883_014,"jumping at her, yanking her by the hair, starting to pull her along, out of control, his words indistinct. IWOULDNOTSAYSUCHTHINGSIFIWEREYOU! (at Westley) You truly love each other, and so you might have been truly happy. Not one couple in a century has that chance, no matter what the storybooks say. And so I think no man in a century will suffer as greatly as you will.",0883_0411
0883,0883_004,0883_006,0883_019,"(sharpening his dagger) Rise and report.The Thieves' Forest is emptied. Thirty men guard the castle gate.Double it. My Princess must be safe.The gate has but one key, and I carry that.Yes. Yes, of course. Naturally, not those four.","0883_0398,0883_0399,0883_0400,0883_0401,0883_0404"
0883,0883_004,0883_007,0883_019,"(clears his throat, begins to speak) Mawidge, the bwessed awwangement, that dweam wiffim a dweam...",0883_0538
0883,0883_004,0883_008,0883_011,"I just hope it's enough to buy a miracle, that's all.(opening a small window in the door)Are you the Miracle Max who worked for the King all those years?(looking at the Giant) You are the Brute Squad.We need a miracle. It's very important.Look, I'm retired. And besides, why would you want someone the King's stinking son fired? I might kill whoever you wanted me to miracle.He's already dead.(for the first time, interested) He is, eh? I'll take a look. Bring him in. I've seen worse.Sir. Sir.Hah?We're really in a terrible rush.(He takes nothing from nobody) Don't rush me, sonny. You rush a miracle man, you get rotten miracles. You got money?Sixty-five.Sheesh! I never worked for so little, except once, and that was a very noble cause.This is noble, sir.Are you a rotten liar.I need him to help avenge my father, murdered these twenty years.Your first story was better.(stupefied) He's dead. He can't talk.Look who knows so much. Well, it just so happens that your friend here is only mostly dead. There's a big difference between mostly dead and all dead. Please open his mouth. Now, mostly dead is slightly alive. Now, all dead...well, with all dead, there's usually only one thing that you can do.What's that?True love. You heard him. You could not ask for a more noble cause than that.(to Valerie) Shut up --Humiliations galore!That is a noble cause. Give me the sixty-five, I'm on the job.A good hour. Yeah.(heading out the door, Fezzik close behind)","0883_0437,0883_0439,0883_0440,0883_0443,0883_0444,0883_0445,0883_0446,0883_0447,0883_0448,0883_0449,0883_0450,0883_0451,0883_0452,0883_0453,0883_0454,0883_0455,0883_0456,0883_0457,0883_0458,0883_0459,0883_0460,0883_0463,0883_0480,0883_0481,0883_0482,0883_0487,0883_0488"
0883,0883_004,0883_008,0883_014,Not to fifty!!!,0883_0412
0883,0883_004,0883_008,0883_015,"Humperdinck. Humperdinck! Humperdinck!-- But this is Buttercup's true love -- If you heal him, he will stop Humperdinck's wedding.(a little appalled) That's a miracle pill?","0883_0477,0883_0478,0883_0483"
0883,0883_004,0883_008,0883_019,"Well, you give him some trouble. Move!keeping the Brutes in position, or trying to, shouting orders, instructions and as yet the Brutes hold. Now --","0883_0371,0883_0544"
0883,0883_004,0883_008,0883_020,(barely able to speak) It just is not fair.,0883_0422
0883,0883_004,0883_011,0883_011,"Sonny, true love is the greatest thing in the world. Except for a nice MLT, a mutton, lettuce and tomato sandwich, where the mutton is nice and lean and the tomato is ripe. They're so perky, I love that. But that's not what he said. He distinctly said ""to blave."" And, as we all know, ""to blave"" means ""to bluff."" So you're probably playing cards, and he cheated",0883_0464
0883,0883_004,0883_011,0883_015,"-- get back, witch --I'm not a witch, I'm your wife. But after what you just said, I'm not even sure I want to be that anymore.You never had it so good.""True love."" He said, ""true love,"" Max. My God --(retreating) Don't say another word, Valerie.(turning to Inigo and Fezzik) He's afraid. Ever since Prince Humperdinck fired him, his confidence is shattered.Why'd you say that name -- you promised me that you would never say that name --(pursuing him now) What, Humperdinck? Humperdinck. Humperdinck. Ooo-ooo, Humperdinck(holding his hands over his ears)A life expiring and you don't have the decency to say why you won't help --Nobody's hearing nothing!Humperdinck. Humperdinck --(finishing) The chocolate coating makes it go down easier. But you have to wait fifteen minutes for full potency. And you shouldn't go swimming after, for at least, what?An hour.Yeah, an hour.Okay.(waving after them) Bye-bye, boys.Have fun storming the castle.(to Max) Think it'll work?It would take a miracle. Bye!","0883_0466,0883_0467,0883_0468,0883_0469,0883_0470,0883_0471,0883_0472,0883_0473,0883_0474,0883_0475,0883_0476,0883_0479,0883_0484,0883_0485,0883_0486,0883_0489,0883_0490,0883_0491,0883_0492,0883_0493"
0883,0883_004,0883_011,0883_018,Go through his clothes and look for loose change. (to Westley) Hey! Hello in there. Hey! What's so important? What you got here that's worth living for?,0883_0461
0883,0883_004,0883_006,0883_008,(he is possessed by demons now) (big) There will be blood tonight!!,0883_0397
0883,0883_004,0883_008,0883_018,"He kneels, the sword held tight between his hands. Eyes closed, he faces the grove of trees, starts to talk, his voice low and strange. Father, I have failed you for twenty years. Now our misery can end. Somewhere ... somewhere close by is a man who can help us. I cannot find him alone. I need you. I need you to guide my sword. Please. Guide my sword. walking blind through the grove of trees. He moves to the Secret Knot, hesitates, then moves past it.... tr ... oooo .... luv...Pill in hand, he drops it into Westley's mouth. Your guess is as good as mine --We had Miracle Max make a pill to bring you back.Who are you? -- Are we enemies? Why am I on this wall? -- Where's Buttercup? --Let me explain -- Buttercup is marrying Humperdinck in a little less than half an hour, so all we have to do is get in, break up the wedding, steal the Princess, make our escape after I kill Count Rugen.I've always been a quick healer.There is but one working castle gate. And it is guarded by sixty men.And our assets?Your brains, Fezzik's strength, my steel.My brains, his steel, and your strength against sixty men, and you think a little head jiggle is supposed to make me happy? I mean, if we only had a wheelbarrow, that would be something.Well, why didn't you list that among our assets in the first place? What I wouldn't give for a holocaust cloak.All right, all right. Come on, help me up. Now, I'll need a sword eventually.Why? You can't even lift one.True, but that's hardly common knowledge, is it? (And his bead tilts limply back. Fezzik sets it up right for him)Now?Now?","0883_0419,0883_0462,0883_0500,0883_0505,0883_0506,0883_0507,0883_0510,0883_0511,0883_0512,0883_0513,0883_0516,0883_0519,0883_0524,0883_0525,0883_0526,0883_0541,0883_0545"
0883,0883_004,0883_005,0883_020,"(off-screen) -- Grandpa, Grandpa -- wait -- -- wait -- what did FEZZIK mean, ""He's dead?"" I mean he didn't mean dead. Westley's only faking, right?You want me to read this or not?Who gets Humperdinck?I don't understand.Who kills Prince Humperdinck? At the end, somebody's got to do it. Is it Inigo? Who?Nobody. Nobody kills him. He lives.You mean he wins? Jesus, Grandpa! What did you read me this thing for?You know, you've been very sick and you're taking this story very seriously. I think we better stop now.(shaking his head) No! I'm okay. I'm okay.","0883_0423,0883_0424,0883_0425,0883_0426,0883_0427,0883_0428,0883_0429,0883_0430,0883_0431"
0883,0883_004,0883_003,0883_004,I hope we win...,0883_0532
0883,0883_004,0883_005,0883_008,"(off-screen) FEZZIK and Inigo were reunited. And as FEZZIK nursed his inebriated friend back to health, he told Inigo of Vizzini's death and the existence of Count Rugen, the sixfingered man. Considering Inigo's lifelong search, he handled the news surprisingly well. (off-screen) Fezzik took great care in reviving Inigo.Okay. (sitting and opening the book again)","0883_0384,0883_0432"
0883,0883_004,0883_005,0883_019,(off-screen) The day of the wedding arrived. The Brute Squad had their hands full carrying out Humperdinck's orders.,0883_0368
0883,0883_004,0883_002,0883_008,"drunk as a skunk, sprawled in front of a hovel, a bottle of brandy in one hand, the six-fingered sword in the other. He looks dreadful. Unshaven, puffy-eyed, gaunt. But the way he brandishes the great sword in front of him would give anyone cause for worry. I am waiting for you, Vizzini. You told me to go back to the beginning. So I have. This is where I am, and this is where I'll stay. I will not be moved.Ho there.I do not budge. Keep your ""Ho there.""But the Prince gave orders ---- So did Vizzini -- when a job went wrong, you went back to the beginning. And this is where we got the job. So it's the beginning, and I'm staying till Vizzini comes.(gesturing off-screen) You! Brute! Come here.","0883_0372,0883_0373,0883_0374,0883_0375,0883_0376,0883_0377"
0883,0883_004,0883_003,0883_006,"Ah! My dulcet darling. Tonight we marry. Tomorrow morning, your men will escort us to Florin Channel where every ship in my armada waits to accompany us on our honeymoon.Every ship but your four fastest, you mean. Every ship but the four you sent.staring at Humperdinck. You never sent the ships. Don't bother lying. It doesn't matter. Westley will come for me anyway.(sharply) You're a silly girl.Yes, I am a silly girl, for not having seen sooner that you were nothing but a coward with a heart full of fear.(close to erupting; speaks very distinctly)Why not? You can't hurt me. Westley and I are joined by the bonds of love. And you cannot track that. Not with a thousand bloodhounds. And you cannot break it. Not with a thousand swords. And when I say you are a coward, that is only because you are the slimiest weakling ever to crawl the earth.in her bridal gown, and she's incredible. It's not just her beauty; there's a tranquillity about her now.You don't seem excited, my little muffin.Should I be?Brides often are, I'm told.","0883_0402,0883_0403,0883_0406,0883_0407,0883_0408,0883_0409,0883_0410,0883_0533,0883_0534,0883_0535,0883_0536"
0883,0883_004,0883_003,0883_007,"(gently, confidently) I do not marry tonight. and she couldn't seem more serene. My Westley will save me.",0883_0537
0883,0883_004,0883_003,0883_019,"(bows, exits) Your Majesties.",0883_0405
0883,0883_004,0883_004,0883_005,Yeah?,0883_0383
0883,0883_004,0883_002,0883_019,(to an unpleasantlooking assistant)Almost. There's a Spaniard giving us some trouble.,"0883_0369,0883_0370"
0883,0883_004,0883_004,0883_008,"-- I -- am -- waiting -- for -- Vizzini --Hello.It's you.True! You don't look so good. (after Inigo blasts air in protest)Perhaps not. I feel fine.(up and going) That's enough. That's enough! Where is this Rugen so I may kill him?He's with the Prince in the Castle. But the castle gate is guarded by thirty men.How many could you handle?I don't think more than ten.(doing the math on his fingers) That leaves twenty for me. At my best, I could never defeat that many.But Vizzini's dead.No -- not Vizzini -- I need the Man in Black ---- what? ---- look, he bested you with strength, your greatness. He bested me with steel. He must have outthought Vizzini, and a man who can do that can plan my castle's onslaught any day. Let's go ---- where?To find the Man in Black, obviously.But you don't know where he is.(instantly) FEZZIK, FEZZIK, listen, do you hear? -- That is the sound of ultimate suffering. My heart made that sound when Rugen slaughtered my father. The Man in Black makes it now.The Man in Black?His true love is marrying another tonight, so who else has cause for Ultimate Suffering? -- pardon me, it's important -- -- Fezzik, please --(gigantic and roaring) Everybody ... MOVE!!Thank you. Where is the Man in Black? You get there from this grove, yes? Fezzik, jog his memory.(upset) I'm sorry, Inigo. I didn't mean to jog him so hard. Inigo?He's dead.Well, we Montoyas have never taken defeat easily. Come along, Fezzik. Bring the body.The body?(not stopping) Have you any money?I have a little.Inigo -- there's more than thirty --(absolutely unfazed) What's the difference? (indicating the half- dead Westley)Has it been fifteen minutes?We can't wait -- the wedding's in half an hour and we must strike in the hustle and the bustle beforehand. Tilt his head back. Open his mouth.(following orders) How long do we have to wait before we know if the miracle works?You've been mostly dead all day.Where did we put that wheelbarrow the Albino had?There we cannot help you.(pulling one out) Will this do?(to Fezzik-- surprised) Where did you get that?I'll say -- how do I find the Count? -- Once I do, how do I find you again? -- Once I find you again, how do we escape? --(sharply) Don't pester him, he's had a hard day.(nods) Right, right, sorry.Inigo.What?(deep and booming) I AM THE DREAD PIRATE ROBERTS. THERE WILL BE NO SURVIVORS. and he seems to be floating because he's standing in the wheelbarrow, as Inigo, hidden behind him, busts a gut by pushing it and supporting Westley.","0883_0378,0883_0379,0883_0380,0883_0381,0883_0382,0883_0385,0883_0386,0883_0387,0883_0388,0883_0389,0883_0390,0883_0391,0883_0392,0883_0393,0883_0394,0883_0395,0883_0396,0883_0413,0883_0414,0883_0415,0883_0416,0883_0417,0883_0418,0883_0421,0883_0433,0883_0434,0883_0435,0883_0436,0883_0495,0883_0496,0883_0497,0883_0498,0883_0499,0883_0504,0883_0517,0883_0520,0883_0521,0883_0522,0883_0527,0883_0528,0883_0529,0883_0530,0883_0531,0883_0540"
