mid,sid,node_i,node_j,utterance,uid
0883,0883_004,0883_004,0883_011,"The King's stinking son fired me. And thank you so much for bringing up such a painful subject. While you're at it, why don't you give me a nice paper cut and pour lemon juice on it? We're closed! (opening the window) Beat it or I'll call the Brute Squad.I'm on the Brute Squad.","0883_0441,0883_0442"
0883,0883_004,0883_004,0883_015,Bye.,0883_0494
0883,0883_004,0883_004,0883_018,"dead by The Machine. FEZZIK leans over him, listening for a heartbeat. Then he looks at Inigo, shakes his head.(frantic) I'll beat you both apart. I'll take you both together.Guess not very long.Why won't my arms move?That doesn't leave much time for dilly dallying.You've just wiggled your finger. That's wonderful.absolutely stunned. That's it? Impossible. If I had a month to plan, maybe I could come up with something. But this...(trying to be cheery) You just shook your head -- that doesn't make you happy?Over the Albino, I think.At Miracle Max's. It fit so nice, he said I could keep it.Not yet.Light him.","0883_0420,0883_0501,0883_0502,0883_0503,0883_0508,0883_0509,0883_0514,0883_0515,0883_0518,0883_0523,0883_0542,0883_0546"
0883,0883_004,0883_004,0883_007,(roaring) THE DREAD PIRATE ROBERTS TAKES NO SURVIVORS. ALL YOUR WORST,0883_0547
0883,0883_004,0883_004,0883_019,"(off-screen) Stand your ground, men. Stand your ground. Stand your ground.MY MEN ARE HERE, AND I AM HERE, BUT SOON YOU WILL NOT BE HERE","0883_0539,0883_0543"
0883,0883_005,0883_006,0883_007,"... so tweasuwe your vruv..Skip to the end.And do you, Pwincess Buwwercwup...Man and wife -- say man and wife...Man and wife.","0883_0551,0883_0552,0883_0564,0883_0565,0883_0566"
0883,0883_005,0883_006,0883_008,Because he has no strength --and now be starts wrestling mightily with his bonds. I knew it! I knew you were bluffing! I knew he was bluffing.,"0883_0634,0883_0635"
0883,0883_005,0883_006,0883_018,"FEZZIK, the portcullis.Then you're not married -- if you didn't say it, you didn't do itentering the room, staring at them. He pulls out his sword. A technicality that will shortly be remedied. But first things first. To the death.No.(about to charge, stops short)I'll explain. And I'll use small words so that you'll be sure to understand, you wart-hog-faced buffoon.That may be the first time in my life a man has dared insult me.lying there comfortably, his words quiet at first. It won't be the last. To the pain means the first thing you lose will be your feet, below the ankles, then your hands at the wrists, next your nose.gripping his sword, watching. -- and then my tongue, I suppose. I killed you too quickly the last time, a mistake I don't mean to duplicate tonight.I wasn't finished -- the next thing you lose will be your left eye, followed by your right --(takes step forward) -- and then my ears, I understand. Let's get on with itWrong! Your ears you keep, and I'll tell you why --And now he stops, and the look that was in his eyes at the wedding, that look of fear, is starting to return.-- so that every shriek of every child at seeing your hideousness will be yours to cherish -- every babe that weeps at your approach, every woman who cries out, ""Dear God, what is that thing?"" will echo in your perfect ears. That is what ""to the pain"" means. It means I leave you in anguish, wallowing in freakish misery forever.doing his best to hide the fear that keeps building inside him. I think you're bluffing --lying there, staring at him. It's possible, pig -- I might be bluffing -- it's conceivable, you miserable vomitous mass, that I'm only lying here because I lack the strength to stand -- then again, perhaps I have the strength after all.staring, eyes wide.","0883_0555,0883_0611,0883_0612,0883_0613,0883_0614,0883_0615,0883_0616,0883_0617,0883_0618,0883_0619,0883_0620,0883_0621,0883_0622,0883_0623,0883_0624,0883_0625,0883_0626"
0883,0883_005,0883_007,0883_019,"as suddenly the Brutes just scream and take off in wild panic -- Stay where you are. I said stay where you are!Oh, you mean this gate key.","0883_0550,0883_0563"
0883,0883_005,0883_008,0883_014,"Kill the dark one and the giant, but leave the third for questioning.behind him, coming like a streak and -- closing the gap, closer, closer and he's down the stairs and heading into a dining hall and -- trying like hell to get out of the way, but no, and it sticks deep into his stomach, and he hurtles back helplessly against the wall of the room, his eyes glazed, blood coming from his wound. ... Sorry, Father ... I tried ... I tried...Good heavens. Are you still trying to win? You've got an overdeveloped sense of vengeance. It's going to get you into trouble some day.And as this blow comes he's trying to use the wall for support in forcing himself to his feet, and it's not a roaring success of an attempt, but he does at least make some progress, and again he manages to parry the thrust, as this time Rugen's sword runs through his right arm. Again, Inigo doesn't seem to mind, doesn't even feel it. slowly pushing away from the wall. (all but audible) Hello. My name is Inigo Montoya, you killed my father; prepare to die. pushing slowly off from the wall again. (a little louder) Hello. My name is Inigo Montoya, you killed my father, prepare to die. (a little louder still) Hello. My name is Inigo Montoya. You killed my father. Prepare to die.Stop saying that!(all he's got) HELLO! MY NAME IS INIGO MONTOYA. YOU KILLED MY FATHER. PREPARE TO DIE.No ---- offer me money ---- yes ---- power too -- promise me that ---- all that I have and more please ---- offer me everything I ask for ---- anything you want --(roaring) I WANT MY FATHER BACK, YOU SON- OFA-BITCH! and almost too fast for the eye to follow, the sword strikes one final time and --lying dead. His skin is ashen and the blood still pours from the parallel cuts on his cheeks and his eyes are bulging wide, full of fear.","0883_0569,0883_0580,0883_0588,0883_0589,0883_0590,0883_0591,0883_0592,0883_0593,0883_0594,0883_0595,0883_0596,0883_0597,0883_0598,0883_0599,0883_0600"
0883,0883_005,0883_008,0883_018,"And now he is standing, sword in fighting position. (slow and determined) DROP-YOUR-SWORD. (to Humperdinck) Have a seat. speaking to Buttercup as Humperdinck sits. Tie him up. Make it as tight as you like.entering, looking around. Where's Fezzik?I thought he was with you.No.In that case --(staring at the Prince) Shall I dispatch him for you?You know, it's very strange -- I have been in the revenge business so long, now that it's over, I don't know what to do with the rest of my life.","0883_0627,0883_0628,0883_0629,0883_0630,0883_0631,0883_0636,0883_0641"
0883,0883_005,0883_008,0883_019,(every ounce of honesty he's got),0883_0560
0883,0883_005,0883_005,0883_020,"(off-screen) They rode to freedom. And as dawn arose, Westley and Buttercup knew they were safe. A wave of love swept over them. And as they reached for each other...What? What?No, it's kissing again. You don't want to hear it.I don't mind so much.Okay. (off-screen) Since the invention of the kiss, there have been five kisses that were rated the most passionate, the most pure. This one left them all behind. The end. Now I think you ought to go to sleep.Okay.(standing, readying to leave) Okay. Okay. Okay. All right. So long.Grandpa? Maybe you could come over and read it again to me tomorrow.(a beat) As you wish...","0883_0643,0883_0644,0883_0645,0883_0646,0883_0647,0883_0648,0883_0649,0883_0650,0883_0651"
0883,0883_005,0883_009,0883_013,(can hardly be understood) Strange wedding.Yes. A very strange wedding. Come along.,"0883_0575,0883_0576"
0883,0883_005,0883_008,0883_009,"still hammering the door. Fezzik approaches, gestures for him to stop, and with one mighty swipe of his mighty hands the door crumbles INIGO Thank you --(smiling away --his hearing isn't what it once was)","0883_0574,0883_0579"
0883,0883_005,0883_005,0883_018,(as Inigo gets him ready for his jump),0883_0642
0883,0883_005,0883_003,0883_014,standing there. Dazed. He didn't come.You must be that little Spanish brat I taught a lesson to all those years ago. It's simply incredible. Have you been chasing me your whole life only to fail now? I think that's the worst thing I ever heard. How marvelous.,"0883_0568,0883_0581"
0883,0883_005,0883_004,0883_018,"(considers this, then) Thank you, but no -- whatever happens to us, I want him to live a long life alone with his cowardice.",0883_0637
0883,0883_005,0883_004,0883_008,"Fezzik, tear his arms off.(to Rugen, evenly and soft) Hello. My name is Inigo Montoya. You killed my father. Prepare to die. momentarily surprised, then taking off after him, leaving Westley and Fezzik to exchange curious looks and Rugen, running through a half-open heavy wooden door, shutting it and locking it just as Inigo throws himself against it. He tries again. No kind of chance. (calling out) Fezzik, I need you --(indicating Westley) I can't leave him alone.desperately pounding at the heavy door. He's getting away from me, Fezzik. Please. FEZZIK!(to Westley) I'll be right back.(off-screen) Inigo! Inigo, where are you? leading FOUR GREAT WHITE HORSES. He glances up, sees them on the balcony. Ah, there you are. Inigo, I saw the Prince's stables, and there they were, four white horses. And I thought, there are four of us, if we ever find the lad -- hello, lad -- so I took them with me, in case we ever bumped into each other.FEZZIK, you did something right.Don't worry -- I won't let it go to my head.","0883_0561,0883_0570,0883_0571,0883_0572,0883_0573,0883_0638,0883_0639,0883_0640"
0883,0883_005,0883_004,0883_007,"... Ven wuv, twoo wuv, wiw fowwow you fowever..",0883_0548
0883,0883_005,0883_003,0883_019,(never more serene) Then why is there fear behind your eyes?,0883_0557
0883,0883_005,0883_003,0883_018,"Here comes my Westley now.shutting the door of the Honeymoon Suite, crossing quietly to the far wall where she sits at a table, opens a jeweled box, and takes out a very deadly looking dagger. She seems very much at peace as she touches the knife to her bosom.There's a shortage of perfect breasts in this world. It would be a pity to damage yours. lying on the bed. Yellin's sword is beside him. His voice sounds just fine, but he does not move.Oh, Westley, darling.(gently) Gently.At a time like this that's all you can think to say? ""Gently?""Oh, Westley, will you ever forgive me?What hideous sin have you committed lately?I got married. I didn't want to. It all happened so fast.It never happened.What?It never happened.But it did. I was there. This old man said, ""Man and wife.""Did you say, ""I do""?Well, no, we sort of skipped that part.","0883_0554,0883_0582,0883_0583,0883_0584,0883_0585,0883_0586,0883_0602,0883_0603,0883_0604,0883_0605,0883_0606,0883_0607,0883_0608,0883_0609,0883_0610"
0883,0883_005,0883_003,0883_009,What was that for?Because you've always been so kind to me. And I won't be seeing you again since I'm killing myself once we reach the Honeymoon Suite.,"0883_0577,0883_0578"
0883,0883_005,0883_003,0883_008,"staring at Rugen. And now Inigo does something we have never seen him do before: he smiles. HOLD FOR JUST A MOMENT on Inigo smiling, then --(to Buttercup) Help him.Why does Westley need helping?","0883_0601,0883_0632,0883_0633"
0883,0883_005,0883_003,0883_007,Have you the wing?,0883_0553
0883,0883_005,0883_003,0883_006,Your Westley is dead. I killed him myself.(whirling to the King and Queen),"0883_0556,0883_0567"
0883,0883_005,0883_014,0883_018,(not so gently) Gently!!,0883_0587
0883,0883_005,0883_004,0883_019,THE DREAD PIRATE ROBERTS IS HERE FOR YOUR SOULS!steps toward him.,"0883_0549,0883_0562"
0883,0883_005,0883_018,0883_019,"pressed against the main gate. Westley, Inigo, and FEZZIK close in.Give us the gate key.","0883_0558,0883_0559"
