mid,sid,node_i,node_j,utterance,uid
0883,0883_000,0883_003,0883_005,"(off-screen) ""As you wish"" was all he ever said to her.(off-screen) That day, she was amazed to discover that when he was saying, ""As you wish,"" what he meant was, ""I love you."" (off-screen) And even more amazing was the day she realized she truly loved him back.(off-screen) She went into her room and shut the door. And for days, she neither slept nor ate.(no emotion at all in her voice)","0883_0002,0883_0005,0883_0020,0883_0021"
0883,0883_000,0883_003,0883_018,Farm boy. Polish my horse's saddle. I want to see my face shining in it by morning.Farm Boy. Fill these with water --(pointing to a pitcher that she could reach herself)I fear I'll never see you again.Of course you will.But what if something happens to you?Hear this now: I will come for you.But how can you be sure?,"0883_0000,0883_0003,0883_0006,0883_0012,0883_0013,0883_0014,0883_0015,0883_0016"
0883,0883_000,0883_003,0883_020,(off-screen groaning) I don't be-leeve this.,0883_0011
0883,0883_000,0883_005,0883_018,"(quietly, watching her) As you wish.As you wish.As you wish.This is true love. You think this happens every day?","0883_0001,0883_0004,0883_0007,0883_0017"
0883,0883_000,0883_005,0883_020,"-- wait, just wait ---- well, when does it get good?Keep your shirt on. Let me read. (off-screen reading) It was a very emotional time for Buttercup --(off-screen reading) Westley didn't reach his destination. His ship was attacked by the Dread Pirate Roberts, who never left captives alive. When Buttercup got the news that Westley was murdered --(off-screen, perking up a little)","0883_0008,0883_0009,0883_0010,0883_0018,0883_0019"
0883,0883_001,0883_016,0883_020,We're back in the boat. Those are the Shrieking Eels.,0883_0070
0883,0883_001,0883_016,0883_016,"Whoever he is, he's too late --",0883_0080
0883,0883_001,0883_008,0883_016,"Then there will be no one to hear you scream-What is that you're ripping?(whirling on Fezzik) Am I going mad or did the word ""think"" escape your lips? You were not hired for your brains, you hippopotamic land mass.I agree with Fezzik.(We only thought he was in a fury --now he's really getting mad) (to Inigo) -- when I found you, you were so slobbering drunk you couldn't buy brandy -- (now to Fezzik, who retreats as much as he can while Vizzini advances)(whirling on them) Enough of that.(to Inigo) We'll reach the Cliffs by dawn. Why are you doing that?Making sure nobody's following us.Of all the necks on this boat, Highness, the one you should be worrying about is your own. Stop doing that. We can all relax, it's almost over-You're sure nobody's following us?As I told you, it would be absolutely, totally, and in all other ways, inconceivable. No one in Guilder knows what we've done. And no one in Florin could have gotten here so fast. Out of curiosity, why do you ask?No reason. It's only, I just happened to look behind us, and something is there.What? (explaining with as much logic as he can muster) Go in, get after her!Put her down. Just put her down.pointing behind them. I think he's getting closer.Look! He's right on top of us. I wonder if he is using the same wind we are using.","0883_0027,0883_0028,0883_0035,0883_0036,0883_0037,0883_0044,0883_0049,0883_0050,0883_0053,0883_0054,0883_0055,0883_0056,0883_0057,0883_0075,0883_0076,0883_0079"
0883,0883_001,0883_005,0883_016,"(off-screen) Buttercup's emptiness consumed her. Although the law of the land gave Humperdinck the right to choose his bride, she did not love him. (off-screen) Despite Humperdinck's reassurance that she would grow to love him, the only joy she found was in her daily ride.Do you know what that sound is, Highness? Those are the Shrieking Eels -- if you doubt me, just wait. They always grow louder when they're about to feed on human flesh. If you swim back now, I promise, no harm will come to you. I doubt you will get such an offer from the Eels.(reading) ""Do you know what that sound is, Highness?""(off-screen) All right, all right, let's see. Uh, she was in the water, the Eel was coming after her. She was frightened. The Eel started to charge her. And then -","0883_0024,0883_0062,0883_0069,0883_0074"
0883,0883_001,0883_005,0883_006,"(off-screen reading) Five years later, the main square of Florin City was filled as never before to hear the announcement of the great Prince Humperdinck's bride-to be.(raises his hands, starts to speak) My people ... the Princess Buttercup!!","0883_0022,0883_0023"
0883,0883_001,0883_005,0883_020,"(off-screen) She doesn't get eaten by the Eels at this time.What?The Eel doesn't get her. I'm explaining to you because you looked nervous.Well, I wasn't nervous. Well, maybe I was a little bit concerned. But that's not the same thing.Because I can stop now if you want.No. You could read a little bit more ... if you want.(off-screen) We're past that, Grandpa. You read it already.","0883_0063,0883_0064,0883_0065,0883_0066,0883_0067,0883_0068,0883_0071"
0883,0883_001,0883_004,0883_008,"(softly) That Vizzini, he can fuss. (a slight emphasis on the last word)(looking at Inigo) ... fuss ... fuss ... (Suddenly, he's got it again, emphasis on the last word.)Probably he means no harm.He's really very short on charm.(proudly) Oh, you've a great gift for rhyme.FEZZIK, are there rocks ahead?I don't swim.","0883_0038,0883_0039,0883_0040,0883_0041,0883_0042,0883_0045,0883_0058"
0883,0883_001,0883_003,0883_016,"We are but poor, lost circus performers. Is there a village nearby?There is nothing nearby; not for miles.That would be inconceivable.Despite what you think, you will be caught. And when you are, the Prince will see you all hanged.Veer left. Left. Left!still close to the boat, switching from a crawl to a silent breast stroke. The wind dies and as it does, something new is heard. A not-too-distant high-pitched shrieking sound.He's no concern of ours. Sail on!","0883_0025,0883_0026,0883_0051,0883_0052,0883_0060,0883_0061,0883_0077"
0883,0883_001,0883_003,0883_008,(staring deep at him) Only compared to some.,0883_0078
0883,0883_001,0883_003,0883_005,"Oh. Oh my goodness, I did. I'm sorry. Beg your pardon.treading water.","0883_0072,0883_0073"
0883,0883_001,0883_004,0883_016,"(not stopping or turning) It's fabric from the uniform of an Army officer of Guilder.Who's Guilder?(pointing straight out) The country across the sea. The sworn enemy of Florin. Once the horse reaches the castle, the fabric will make the Prince suspect the Guilderians have abducted his love. When he finds her body dead on the Guilder frontier, his suspicions will be totally confirmed.You never said anything about killing anyone.I've hired you to help me start a war. That's a prestigious line of work with a long and glorious tradition.I just don't think it's right, killing an innocent girl.Yes, some of the time.If there are, we'll all be dead.No more rhymes now, I mean it.Anybody want a peanut?(to the unasked question) I only dog paddle.","0883_0029,0883_0030,0883_0031,0883_0032,0883_0033,0883_0034,0883_0043,0883_0046,0883_0047,0883_0048,0883_0059"
0883,0883_002,0883_005,0883_020,"(off-screen) Oh no. No, please.What is it? What's the matter?They're kissing again, do we have to hear the kissing part?Someday, you may not mind so much.Skip on to the Fire Swamp -- that sounded good.","0883_0268,0883_0269,0883_0270,0883_0271,0883_0272"
0883,0883_002,0883_018,0883_020,There will never be a need.,0883_0267
0883,0883_002,0883_016,0883_022,"I would as soon destroy a stained glass window as an artist like yourself. However, since I can't have you following me either -- Please understand, I hold you in the highest respect.So, it is down to you. And it is down to me. If you wish her dead, by all means keep moving forward.Let me explain--- there's nothing to explain. You're trying to kidnap what I've rightfully stolen.Perhaps an arrangement can be reached.There will be no arrangement --But if there can be no arrangement, then we are at an impasse.I'm afraid so -- I can't compete with you physically. And you're no match for my brains.You're that smart?Let me put it this way: have you ever heard of Plato, Aristotle, Socrates?Yes.Morons.Really? In that case, I challenge you to a battle of wits.For the Princess? To the death? I accept.Good. Then pour the wine. Inhale this, but do not touch.(doing it) I smell nothing.(taking the packet back) What you do not smell is called iocane powder. It is odorless, tasteless, dissolves instantly in liquid, and is among the more deadlier poisons known to man.Hmm. watching excitedly as the Man In Black takes the goblets, turns his back. A moment later, he turns again, faces Vizzini, drops the iocane packet. It is now empty.All right: where is the poison? The battle of wits has begun. It ends when you decide and we both drink, and find out who is right and who is dead.But it's so simple. All I have to do is divine from what I know of you. Are you the sort of man who would put the poison into his own goblet, or his enemy's? Now, a clever man would put the poison into his own goblet, because he would know that only a great fool would reach for what he was given. I'm not a great fool, so I can clearly not choose the wine in front of you. But you must have known I was not a great fool; you would have counted on it, so I can clearly not choose the wine in front of me.(And now there's a trace of nervousness beginning)Not remotely. Because iocane comes from Australia, as everyone knows. And Australia is entirely peopled with criminals. And criminals are used to having people not trust them, as you are not trusted by me. So I can clearly not choose the wine in front of you.Truly, you have a dizzying intellect.Wait till I get going! Where was I?Australia.Yes -- Australia, and you must have suspected I would have known the powder's origin, so I can clearly not choose the wine in front of me.(very nervous) You're just stalling now.(cackling) You'd like to think that, wouldn't you?You're trying to trick me into giving away something -- it won't work --(triumphant) It has worked -- you've given everything away -- I know where the poison is.(fool's courage) Then make your choice.I will. And I choose -- -- what in the world can that be?What? Where? I don't see anything.busily switching the goblets while the Man In Black has his head turned. Oh, well, I-I could have sworn I saw something. No matter.What's so funny?I'll tell you in a minute. First, let's drink -- me from my glass, and you from yours.You guessed wrong.","0883_0155,0883_0186,0883_0187,0883_0188,0883_0189,0883_0190,0883_0191,0883_0192,0883_0193,0883_0194,0883_0195,0883_0196,0883_0197,0883_0198,0883_0199,0883_0200,0883_0201,0883_0202,0883_0203,0883_0204,0883_0205,0883_0206,0883_0207,0883_0208,0883_0209,0883_0210,0883_0211,0883_0212,0883_0213,0883_0214,0883_0215,0883_0216,0883_0217,0883_0218,0883_0219,0883_0220,0883_0221"
0883,0883_002,0883_014,0883_018,"staring after her. Rugen watches as his warriors bring Westley to him. The Count has a heavy sword and he holds it in his hand.Come, sir. We must get you to your ship.We are men of action. Lies do not become us.Well spoken, sir -- -- what is it?","0883_0309,0883_0310,0883_0311,0883_0312"
0883,0883_002,0883_008,0883_022,"He watches them depart, then turns, peers down over the Cliffs. He watches a moment, then paces, shaking his hands loose. He practices a few of his honed fencing skills. He is a taut and nervous fellow, and has never been one for waiting around. walking away. Finally he goes back to cliff edge, starts to talk. It's instant death if the Man In Black falls, but neither gives that possibility much credence. This is our two heroes meeting. They don't know it yet; but that's what it is. (hollering down) Hello there. Slow going?Look, I don't mean to be rude, but this is not as easy as it looks. So I'd appreciate it if you wouldn't distract me.Sorry.Thank you.I do not suppose you could speed things up?(with some beat) If you're in such a hurry, you could lower a rope, or a tree branch, or find something useful to do.I could do that. In fact, I've got some rope up here. But I do not think that you will accept my help, since I am only waiting around to kill you.That does put a damper on our relationship.But I promise I will not kill you until you reach the top.That's very comforting. But I'm afraid you'll just have to wait.I hate waiting. I could give you my word as a Spaniard.No good. I've known too many Spaniards.You don't know any way you'll trust me?Nothing comes to mind.I swear on the soul of my father, Domingo Montoya, you will reach the top alive.Throw me the rope.He dashes to the giant rock the rope was originally tied to. now with a small coil of rope, hurries back to the edge and hurls it over -- straining, forcing his body away from the cliff edge and -- watching as the Man In Black crawls to safety, then looks to Inigo.(pulling his sword) Thank you.We'll wait until you're ready.Again. Thank you.I do not mean to pry, but you don't by any chance happen to have six fingers on your right hand?Do you always begin conversations this way?My father was slaughtered by a sixfingered man. He was a great swordmaker, my father. And when the six-fingered man appeared and requested a special sword, my father took the job. He slaved a year before he was done.(fondling it-impressed) I have never seen its equal.The six-fingered man returned and demanded it, but at one-tenth his promised price. My father refused. Without a word, the six-fingered man slashed him through the heart. I loved my father, so, naturally, challenged his murderer to a duel ... I failed ... the six-fingered man did leave me alive with the six-fingered sword, but he gave me these.How old were you?I was eleven years old. When I was strong enough, I dedicated my life to the study of fencing. So the next time we meet, I will not fail. I will go up to the sixfingered man and say, ""Hello, my name is Inigo Montoya. You killed my father. Prepare to die.""You've done nothing but study swordplay?More pursuit than study lately. You see, I cannot find him. It's been twenty years now. I am starting to lose confidence. I just work for Vizzini to pay the bills. There's not a lot of money in revenge.(handing back the great sword, starting to rise)You are ready, then?Whether I am or not, you've been more than fair.You seem a decent fellow. I hate to kill you.(walking away a few paces, unsheathing his sword)Begin! (thrilled) You're using Bonetti's defense against me, ah?I thought it fitting, considering the rocky terrain --Naturally, you must expect me to attack with Capo Ferro.(coping as best he can) -- naturally --Unless the enemy has studied his Agrippa- -- which I have. And behind him now, drawing closer all the time, is the deadly edge of the Cliffs of Insanity. Inigo fights and ducks and feints and slashes and it all works, but not for long, as gradually the Man In Black keeps the advantage, keeps forcing Inigo back, closer and closer to death. (happy as a clam) You are wonderful!Thank you -- I've worked hard to become so.I admit it -- you are better than I am.Then why are you smiling?Because I know something you don't know.And what is that?I am not left-handed. and the six-fingered sword is all but invisible now, as he increases his attack, then suddenly switches styles again.You're amazing!I ought to be after twenty years.(hollering it out) There's something I ought to tell you.Tell me.I am not left-handed either.And to his amazement, he is being forced back down the steps. staring in awe. Who are you?!No one of consequence.I must know.Get used to disappointment.Okay. moving like lightning, and he thrusts forward, slashes, darts back, all in almost a single movement and -- And there is never a move anyone makes he doesn't remember, and this time he blocks the slash, slashes out himself with the sixfingered sword. catching it again. And something terrible is written behind his eyes: he has given his all, done everything man can do, tried every style, made every maneuver, but it wasn't enough, and on his face for all to see is the realization that he, Inigo Montoya of Spain, is going to lose. Kill me quickly.","0883_0100,0883_0101,0883_0102,0883_0103,0883_0104,0883_0105,0883_0106,0883_0107,0883_0108,0883_0109,0883_0110,0883_0111,0883_0112,0883_0113,0883_0114,0883_0115,0883_0116,0883_0117,0883_0118,0883_0119,0883_0120,0883_0121,0883_0122,0883_0123,0883_0124,0883_0125,0883_0126,0883_0127,0883_0128,0883_0129,0883_0130,0883_0131,0883_0132,0883_0133,0883_0134,0883_0135,0883_0136,0883_0137,0883_0138,0883_0139,0883_0140,0883_0141,0883_0142,0883_0143,0883_0144,0883_0145,0883_0146,0883_0147,0883_0148,0883_0149,0883_0150,0883_0151,0883_0152,0883_0153,0883_0154"
0883,0883_002,0883_008,0883_016,"Hurry up. Move the thing! Um ... that other thing. Move it!hurrying to FEZZIK. He straps a harness to him, then lifts Buttercup and Vizzini in the harness. Finally, he himself gets in the harness. All three are strapped to FEZZIK like papooses. (looking down) He's climbing the rope. And he's gaining on us.stunned, turning to the others, looking down. He didn't fall? Inconceivable!!(whirling on Vizzini) You keep using that word -- I do not think it means what you think it means.Whoever he is, he's obviously seen us with the Princess, and must therefore die.I want to duel him left-handed.You know what a hurry we're in.Well, it's the only way I can be satisfied. If I use my right -- tch -- over too quickly.(calling out) I'm waiting!","0883_0081,0883_0082,0883_0091,0883_0092,0883_0093,0883_0094,0883_0095,0883_0096,0883_0099"
0883,0883_002,0883_006,0883_022,"I don't envy you the headache you will have when you awake. But, in the meantime, rest well ... and dream of large women.They were both poisoned. I spent the last few years building up an immunity to iocane powder.Someone has beaten a giant!That was a warning, Highness. The next time, my hand flies on its own. For where I come from, there are penalties when a woman lies.","0883_0178,0883_0226,0883_0227,0883_0238"
0883,0883_002,0883_006,0883_016,(vaulting onto his horse) I always think everything could be a trap -- Which is why I'm still alive.,0883_0185
0883,0883_002,0883_006,0883_014,"There was a mighty duel -- it ranged all over. They were both masters.Who won? How did it end?(looking down in the position where Inigo fell unconscious)Shall we track them both?The loser is nothing. -- Only the Princess matters --Could this be a trap?I swear it will be done. (whispering) Once we're out of sight, take him back to Florin and throw him in the Pit of Despair.She's been like that ever since the Fire Swamp.","0883_0179,0883_0180,0883_0181,0883_0182,0883_0183,0883_0184,0883_0306,0883_0322"
0883,0883_002,0883_005,0883_018,"Oh. You're sick, I'll humor you.",0883_0273
0883,0883_002,0883_006,0883_018,"Now, was that so terrible?Surrender!You mean you wish to surrender to me? Very well, I accept.I give you full marks for bravery --don't make yourself a fool.Ah, but how will you capture us? We know the secrets of the Fire Swamp. We can live there quite happily for some time. So, whenever you feel like dying, feel free to visit.I tell you once again -- surrender!(roaring) For the last time -- SURRENDER!whirling to face her. What was that?","0883_0290,0883_0291,0883_0292,0883_0293,0883_0294,0883_0295,0883_0298,0883_0301"
0883,0883_002,0883_004,0883_022,"(little frown; softly) My way's not very sportsmanlike. He moves into the mountain path. He has picked up another rock and holds it lightly. I did that on purpose. I don't have to miss.I believe you -- So what happens now?We face each other as God intended. Sportsmanlike. No tricks, no weapons, skill against skill alone.You mean, you'll put down your rock and I'll put down my sword, and we'll try to kill each other like civilized people?(gently) I could kill you now.Frankly, I think the odds are slightly in your favor at hand fighting.It's not my fault being the biggest and the strongest. I don't even exercise.Look are you just fiddling around with me or what?I just want you to feel you're doing well. I hate for people to die embarrassed. as he jumps forward with stunning speed for anyone his size and reaches for the Man In Black who drops to his knees, spins loose, and slips between the Giant's legs. You're quick.And a good thing too.(getting set for another onslaught)Oh no. It's just that they're terribly comfortable. I think everyone will be wearing them in the future.(standing, talking as he does so) as he charges toward a huge rock that lines the path, and just as he reaches it he spins his giant body so that the entire weight of the charge is taken by the Man In Black.(his arms never leave Fezzik's throat)(his voice just beginning to get a little strained)Why should that make such a difference?Well ... (And now his voice is definitely growing weaker) and there isn't much breath coming. as the Man In Black turns him over, puts his ear to FEZZIK's heart. It beats. The Man In Black stands.","0883_0161,0883_0162,0883_0163,0883_0164,0883_0165,0883_0166,0883_0167,0883_0168,0883_0169,0883_0170,0883_0171,0883_0172,0883_0173,0883_0174,0883_0175,0883_0176,0883_0177"
0883,0883_002,0883_004,0883_016,"Inconceivable! (shrieking) Faster!I thought I was going faster.You were supposed to be this colossus. You were this great, legendary thing. And yet he gains.Well, I'm carrying three people. And he's got only himself.(cutting through) -- I do not accept excuses.(hurt) Don't say that, Vizzini. Please.Did I make it clear that your job is at stake? cutting through the last of the rope and CUT TO:standing with Inigo and Buttercup by the cliff edge. (to Inigo -- impressed) He has very good arms.(turns abruptly, starts off-screen)who goes to Inigo. You be careful.Inconceivable! Give her to me. (grabs Buttercup starts off)(starting to panic) What do I do?Finish him, finish him. Your way.Oh, good, my way. Thank you, Vizzini.Pick up one of those rocks, get behind the boulder, and in a few minutes, the Man in Black will come running around the bend. The minute his head is in view, hit it with the rock!","0883_0083,0883_0084,0883_0085,0883_0086,0883_0087,0883_0088,0883_0089,0883_0090,0883_0097,0883_0098,0883_0156,0883_0157,0883_0158,0883_0159,0883_0160"
0883,0883_002,0883_003,0883_022,"Who are you?I am no one to be trifled with, that is all you ever need know.(a final glance back toward Vizzini)(his voice harsh now, carrying the promise of violence)If you'll release me ... whatever you ask for ransom ... you'll get it, I promise you...And what is that worth, the promise of a woman? You're very funny, Highness.I was giving you a chance. No matter where you take me ... there's no greater hunter than Prince Humperdinck. He could track a falcon on a cloudy day. He can find youYou think your dearest love will save you?I never said he was my dearest love. And yes, he will save me. That I know.You admit to me you do not love your fiance?He knows I do not love him.""Are not capable of love"" is what you mean.I have loved more deeply than a killer like yourself could ever dream.being spun INTO CAMERA view, falling heavily as the Man In Black releases her. We are at the edge of an almost sheer ravine. The drop is sharp and severe. Below, the ravine floor is flat, but getting there would not be half the fun.Rest, Highness.(stares at him) I know who you are -- your cruelty reveals everything. You're the Dread Pirate Roberts; admit it.(bowing) With pride. What can I do for you?You can die slowly cut into a thousand pieces.Hardly complimentary, Your Highness. Why loose your venom on me?You killed my love.It's possible; I kill a lot of people. Who was this love of yours? Another Prince, like this one, ugly, rich, and scabby?No. A farm boy. Poor. Poor and perfect, with eyes like the sea after a storm. And probably, if she did not hate Roberts so, there would be tears. On the high seas, your ship attacked, and the Dread Pirate Roberts never takes prisoners.(explaining as a teacher might)You mock my pain!Life is pain, Highness. Anyone who says differently is selling something. I remember this farm boy of yours, I think. This would be, what, five years ago? Does it bother you to hear?Nothing you can say will upset me.He died well, that should please you. No bribe attempts or blubbering. He simply said, ""Please. Please, I need to live."" It was the ""please"" that caught my memory. I asked him what was so important for him. ""True love,"" he replied. And then he spoke of a girl of surpassing beauty and faithfulness. I can only assume he meant you. You should bless me for destroying him before he found out what you really are.And what am I?Faithfulness he talked of, madam. Your enduring faithfulness. Now, tell me truly. When you found out he was gone, did you get engaged to your prince that same hour, or did you wait a whole week out of respect for the dead?You mocked me once, never do it again -- I died that day! and while his attention is on the dust cloud, rising high, she pushes him with all the strength she has. You can die too, for all I care!! staring transfixed at what she has wrought.... as ... you ... wish...","0883_0223,0883_0224,0883_0225,0883_0228,0883_0229,0883_0230,0883_0231,0883_0232,0883_0233,0883_0234,0883_0235,0883_0236,0883_0237,0883_0240,0883_0241,0883_0242,0883_0243,0883_0244,0883_0245,0883_0246,0883_0247,0883_0248,0883_0249,0883_0250,0883_0251,0883_0252,0883_0253,0883_0254,0883_0255,0883_0256,0883_0257"
